{
  "schema_version": 1,
  "operation": "run",
  "outcome": "completed",
  "error": null,
  "policy_inputs": null,
  "receipt": {
    "schema_version": 1,
    "assurance": "Restricted",
    "backend": {
      "name": "synthetic-fixture",
      "version": "1",
      "deprecation": null
    },
    "requested": {
      "filesystem_read": false,
      "filesystem_write": false,
      "network": false,
      "environment_sanitization": false,
      "descriptor_hygiene": false,
      "subprocess_restriction": false,
      "descendant_authority_propagation": false,
      "descendant_lifecycle": false,
      "process_tree_membership": false,
      "complete_cleanup": false,
      "timeout": false,
      "output": false,
      "process_count": false,
      "memory": false
    },
    "declared": {
      "filesystem_read": false,
      "filesystem_write": false,
      "network": false,
      "environment_sanitization": false,
      "descriptor_hygiene": false,
      "subprocess_restriction": false,
      "descendant_authority_propagation": false,
      "descendant_lifecycle": false,
      "process_tree_membership": false,
      "complete_cleanup": false,
      "timeout": false,
      "output": false,
      "process_count": false,
      "memory": false
    },
    "observed": {
      "filesystem_read": false,
      "filesystem_write": false,
      "network": false,
      "environment_sanitization": false,
      "descriptor_hygiene": false,
      "subprocess_restriction": false,
      "descendant_authority_propagation": false,
      "descendant_lifecycle": false,
      "process_tree_membership": false,
      "complete_cleanup": false,
      "timeout": false,
      "output": false,
      "process_count": false,
      "memory": false
    },
    "enforced": {
      "filesystem_read": false,
      "filesystem_write": false,
      "network": false,
      "environment_sanitization": false,
      "descriptor_hygiene": false,
      "subprocess_restriction": false,
      "descendant_authority_propagation": false,
      "descendant_lifecycle": false,
      "process_tree_membership": false,
      "complete_cleanup": false,
      "timeout": false,
      "output": false,
      "process_count": false,
      "memory": false
    },
    "declared_evidence": [],
    "observed_evidence": [],
    "established_evidence": [],
    "effective_filesystem": [],
    "configured_limits": {
      "timeout_seconds": null,
      "max_output_bytes": null,
      "max_processes": null,
      "max_memory_bytes": null
    },
    "termination": "Exited(0)",
    "completion": {
      "confirmed": {
        "filesystem_read": false,
        "filesystem_write": false,
        "network": false,
        "environment_sanitization": false,
        "descriptor_hygiene": false,
        "subprocess_restriction": false,
        "descendant_authority_propagation": false,
        "descendant_lifecycle": false,
        "process_tree_membership": false,
        "complete_cleanup": false,
        "timeout": false,
        "output": false,
        "process_count": false,
        "memory": false
      },
      "evidence": [],
      "cleanup_confidence": "NotGuaranteed"
    },
    "executable_resolution": null
  }
}
